{
  "$schema": "./schema.json",
  "version": "2026-04",
  "updated": "2026-04-15",
  "source": "https://github.com/openintelligence-labs/tokenmiser/blob/main/pricing/SOURCES.md",
  "currency": "USD",
  "units": "per 1M tokens",
  "models": {
    "claude-opus-4-7": {
      "provider": "anthropic",
      "family": "claude-4",
      "tier": "frontier",
      "input": 5.00,
      "output": 25.00
    },
    "claude-sonnet-4-6": {
      "provider": "anthropic",
      "family": "claude-4",
      "tier": "balanced",
      "input": 3.00,
      "output": 15.00
    },
    "claude-haiku-4-5": {
      "provider": "anthropic",
      "family": "claude-4",
      "tier": "fast",
      "input": 1.00,
      "output": 5.00
    },
    "gpt-5": {
      "provider": "openai",
      "family": "gpt-5",
      "tier": "frontier",
      "input": 1.25,
      "output": 10.00
    },
    "gpt-5.4": {
      "provider": "openai",
      "family": "gpt-5",
      "tier": "balanced",
      "input": 2.50,
      "output": 15.00
    },
    "gpt-4o-mini": {
      "provider": "openai",
      "family": "gpt-4",
      "tier": "fast",
      "input": 0.15,
      "output": 0.60
    },
    "gemini-2.5-pro": {
      "provider": "google",
      "family": "gemini-2.5",
      "tier": "frontier",
      "input": 1.00,
      "output": 10.00
    },
    "gemini-2.5-flash": {
      "provider": "google",
      "family": "gemini-2.5",
      "tier": "fast",
      "input": 0.30,
      "output": 2.50
    },
    "deepseek-r1": {
      "provider": "deepseek",
      "family": "deepseek-r1",
      "tier": "balanced",
      "input": 0.29,
      "output": 0.29,
      "notes": "off-peak: $0.12 input / $0.20 output"
    },
    "cerebras-llama3.1-8b": {
      "provider": "cerebras",
      "family": "llama-3.1",
      "tier": "fast",
      "input": 0.10,
      "output": 0.10
    },
    "deepinfra-llama3.1-8b": {
      "provider": "deepinfra",
      "family": "llama-3.1",
      "tier": "fast",
      "input": 0.03,
      "output": 0.05
    }
  }
}
